Filename,Title,Description,Keywords,Category,Releases
"saleor-ascii-shirt-front_thumbnail_1024.png",
"Stylish blue t-shirt design online store apparel photography minimalist setting front view fashion concept for sale",
"Explore a vibrant blue t-shirt showcasing a modern design perfect for casual wear and unique style.",
"store, setting, stylish, photography, minimalist, clothing, style, trend, unique, comfort, quality, wear, look, outfit, print, retail, shopping, lifestyle, social, technology, creativity, youth, sportswear, guide, inspiration",
"3",






"saleor-battle-tested-book_thumbnail_1024.webp",
"Maximize your business success with truly open commerce a practical guide for brands digital marketplace business strategy professional setting insightful concepts","Explore a comprehensive guide to scaling your business effectively with battle-tested strategies and insights.","setting, commerce, e-commerce, concepts, strategy, guide, efficiency, technology, sales, performance, goals, planning, networking, integration, collaboration, productivity, resources, value, channels, engagement, feedback, sustainability, vision, design, intelligence","3",
"saleor-pauls-blanace-420-1_thumbnail_1024.jpg","Dynamic sports shoe display studio product photography minimalist setting front view modern lifestyle concept","Showcasing a vibrant sports shoe in a minimalist studio emphasizing style and movement for an active lifestyle.","setting, photography, minimalist, dynamic, sports, movement, blue, comfort, quality, performance, iconic, brand, appeal, unique, innovative, run, track, living, kitchen, leisure, family, inspiration, motivation, strength, goal","12",